{"$id":"urn:acme-firm:schema:build-recipe:1.0.0","$schema":"https://json-schema.org/draft/2020-12/schema","additionalProperties":false,"description":"Receta canónica fail-closed con registro explícito de generadores y validadores.","properties":{"$schema":{"const":"../schemas/build_recipe.schema.json","type":"string"},"binding_artifacts":{"additionalProperties":false,"properties":{"binding_map_values":{"additionalProperties":false,"properties":{"coping_potential":{"const":"host.baseline.coping_potential","type":"string"},"lambda":{"const":"influence.parameters.lambda","type":"string"},"result":{"const":"output.coping_potential","type":"string"},"z":{"const":"factor_state.level","type":"string"}},"required":["coping_potential","lambda","result","z"],"type":"object"},"consistency_rule":{"const":"all twelve registry, resolved-config and implementation locations resolve to the four approved values; missing, duplicate, implicit or divergent bindings block the build","type":"string"},"implementation":{"additionalProperties":false,"properties":{"anchor_cardinality":{"const":"each semantic anchor occurs exactly once and resolves to the approved binding-map value","type":"string"},"path":{"const":"src/ifatigue_infra6/model.py","type":"string"},"semantic_anchors":{"additionalProperties":false,"properties":{"coping_potential":{"const":"@binding-coping-potential","type":"string"},"lambda":{"const":"@binding-lambda","type":"string"},"result":{"const":"@binding-result","type":"string"},"z":{"const":"@binding-z","type":"string"}},"required":["coping_potential","lambda","result","z"],"type":"object"}},"required":["anchor_cardinality","path","semantic_anchors"],"type":"object"},"input_keys":{"const":["coping_potential","lambda","z"],"type":"array"},"output_key":{"const":"result","type":"string"},"registry":{"additionalProperties":false,"properties":{"locators":{"additionalProperties":false,"properties":{"coping_potential":{"const":"/binding_map/coping_potential","type":"string"},"lambda":{"const":"/binding_map/lambda","type":"string"},"result":{"const":"/binding_map/result","type":"string"},"z":{"const":"/binding_map/z","type":"string"}},"required":["coping_potential","lambda","result","z"],"type":"object"},"path":{"const":"spec/bindings/formula_bindings.json","type":"string"}},"required":["locators","path"],"type":"object"},"resolved_config":{"additionalProperties":false,"properties":{"locators":{"additionalProperties":false,"properties":{"coping_potential":{"const":"/influence/binding_map/coping_potential","type":"string"},"lambda":{"const":"/influence/binding_map/lambda","type":"string"},"result":{"const":"/influence/binding_map/result","type":"string"},"z":{"const":"/influence/binding_map/z","type":"string"}},"required":["coping_potential","lambda","result","z"],"type":"object"},"path":{"const":"config/resolved_instance.json","type":"string"}},"required":["locators","path"],"type":"object"},"result_is_input":{"const":false,"type":"boolean"}},"required":["binding_map_values","consistency_rule","implementation","input_keys","output_key","registry","resolved_config","result_is_input"],"type":"object"},"binding_coverage_rule":{"const":"the derivation ledger, resolved configuration and implementation must each resolve all four bindings explicitly; no implicit default path is allowed","type":"string"},"build_order":{"const":["validate authored source, decision, thesis and binding layers","resolve config/resolved_instance.json","validate and freeze input-only scenarios and independent oracles","run python3 -I -B -X utf8 scripts/build_source_manifest.py --root . --output manifests/SOURCE_SHA256.txt","run python3 -I -B -X utf8 scripts/verify_manifest.py --root . --manifest manifests/SOURCE_SHA256.txt and require exit code zero","run the reference scenario recipe and unit tests","validate coverage and all generated outputs","execute every validator_registry entry and require zero exit codes","write manifests/BUILD_RECORD.json","generate and verify MANIFIESTO_SHA256.txt","build deterministic ZIP and its external SHA-256 sidecar"],"type":"array"},"build_record_path":{"const":"manifests/BUILD_RECORD.json","type":"string"},"coverage_contract":{"additionalProperties":false,"properties":{"additional_execution_controls":{"additionalProperties":false,"properties":{"expected":{"const":3,"type":"integer"}},"required":["expected"],"type":"object"},"artifacts":{"additionalProperties":false,"properties":{"expected":{"const":7,"type":"integer"},"set_id":{"const":"ARTIFACTS-7","type":"string"}},"required":["expected","set_id"],"type":"object"},"central_invariants":{"additionalProperties":false,"properties":{"expected":{"const":5,"type":"integer"}},"required":["expected"],"type":"object"},"coverage_status":{"const":"planned_not_satisfied_until_materialization_and_validation","type":"string"},"independent_oracles":{"additionalProperties":false,"properties":{"expected":{"const":16,"type":"integer"},"set_id":{"const":"ORACLES-16","type":"string"}},"required":["expected","set_id"],"type":"object"},"input_scenarios":{"additionalProperties":false,"properties":{"expected":{"const":16,"type":"integer"},"set_id":{"const":"SCENARIOS-16","type":"string"}},"required":["expected","set_id"],"type":"object"},"modulation_traces":{"additionalProperties":false,"properties":{"expected":{"const":15,"type":"integer"},"set_id":{"const":"TRACES-15","type":"string"}},"required":["expected","set_id"],"type":"object"},"pre_modulation_rejections":{"additionalProperties":false,"properties":{"expected":{"const":1,"type":"integer"},"set_id":{"const":"REJECTIONS-1","type":"string"}},"required":["expected","set_id"],"type":"object"},"reference_results":{"additionalProperties":false,"properties":{"expected":{"const":16,"type":"integer"},"set_id":{"const":"RESULTS-16","type":"string"}},"required":["expected","set_id"],"type":"object"},"unit_test_methods":{"additionalProperties":false,"properties":{"catalog":{"const":"tests/test_catalog.json","type":"string"},"expected":{"const":18,"type":"integer"}},"required":["catalog","expected"],"type":"object"}},"required":["additional_execution_controls","artifacts","central_invariants","coverage_status","independent_oracles","input_scenarios","modulation_traces","pre_modulation_rejections","reference_results","unit_test_methods"],"type":"object"},"failure_policy":{"const":"any missing predecessor, count mismatch, schema failure, hash mismatch, unresolved ledger target or nonzero command exit stops all downstream nodes","type":"string"},"generator_registry":{"additionalProperties":false,"properties":{"current_hashes":{"oneOf":[{"type":"null"},{"additionalProperties":false,"properties":{"commands/validate_qa_verdict.py":{"pattern":"^[0-9a-f]{64}$","type":"string"},"scripts/build_derivation_ledger.py":{"pattern":"^[0-9a-f]{64}$","type":"string"},"scripts/build_release.py":{"pattern":"^[0-9a-f]{64}$","type":"string"},"scripts/build_source_manifest.py":{"pattern":"^[0-9a-f]{64}$","type":"string"},"scripts/compare_outputs.py":{"pattern":"^[0-9a-f]{64}$","type":"string"},"scripts/regenerate_evidence.py":{"pattern":"^[0-9a-f]{64}$","type":"string"},"scripts/run_scenarios.py":{"pattern":"^[0-9a-f]{64}$","type":"string"},"scripts/run_tests.py":{"pattern":"^[0-9a-f]{64}$","type":"string"},"scripts/validate_derivation_ledger.py":{"pattern":"^[0-9a-f]{64}$","type":"string"},"scripts/verify_manifest.py":{"pattern":"^[0-9a-f]{64}$","type":"string"}},"required":["commands/validate_qa_verdict.py","scripts/build_derivation_ledger.py","scripts/build_source_manifest.py","scripts/validate_derivation_ledger.py","scripts/run_scenarios.py","scripts/run_tests.py","scripts/regenerate_evidence.py","scripts/compare_outputs.py","scripts/verify_manifest.py","scripts/build_release.py"],"type":"object"}]},"current_status":{"enum":["hash_registry_planned_not_attested_in_this_decision","materialized_and_hashed"],"type":"string"},"hash_source":{"const":"manifests/SOURCE_SHA256.txt","type":"string"},"required_paths":{"const":["commands/validate_qa_verdict.py","scripts/build_derivation_ledger.py","scripts/build_source_manifest.py","scripts/validate_derivation_ledger.py","scripts/run_scenarios.py","scripts/run_tests.py","scripts/regenerate_evidence.py","scripts/compare_outputs.py","scripts/verify_manifest.py","scripts/build_release.py"],"type":"array"},"rule":{"const":"BUILD_RECIPE.json records the lowercase SHA-256 of every generator and validator after materialization, every listed executable is included in manifests/SOURCE_SHA256.txt, and any hash mismatch is refused","type":"string"}},"required":["current_hashes","current_status","hash_source","required_paths","rule"],"type":"object"},"manual_editing_of_derived_nodes":{"const":"prohibited","type":"string"},"planned_commands":{"const":["python3 -I -B -X utf8 scripts/build_derivation_ledger.py --materialize-bindings-config --materialize-schemas","python3 -I -B -X utf8 scripts/validate_derivation_ledger.py --ledger sources/DERIVATION_LEDGER.csv --schema schemas/derivation_ledger.schema.json --provenance PROVENANCE.json","python3 -I -B -X utf8 scripts/build_source_manifest.py --root . --output manifests/SOURCE_SHA256.txt","python3 -I -B -X utf8 scripts/verify_manifest.py --root . --manifest manifests/SOURCE_SHA256.txt","python3 -I -B -X utf8 scripts/run_scenarios.py","python3 -I -B -X utf8 scripts/run_tests.py","python3 -I -B -X utf8 scripts/regenerate_evidence.py","python3 -I -B -X utf8 scripts/compare_outputs.py","python3 -I -B -X utf8 commands/validate_qa_verdict.py --record reviews/T03_INTERNAL_QA.json --schema schemas/qa_verdict.schema.json","python3 -I -B -X utf8 scripts/verify_manifest.py","python3 -I -B -X utf8 scripts/build_release.py"],"type":"array"},"pre_run_source_manifest_gate":{"additionalProperties":false,"properties":{"build_command":{"const":"python3 -I -B -X utf8 scripts/build_source_manifest.py --root . --output manifests/SOURCE_SHA256.txt","type":"string"},"failure_policy":{"const":"a missing source member, unexpected member, hash mismatch, malformed record or nonzero exit blocks every reference-run node","type":"string"},"source_builder_inclusion":{"const":"scripts/build_source_manifest.py is itself an authored generator included in manifests/SOURCE_SHA256.txt","type":"string"},"stage":{"const":"after all authored inputs, generators and validators are frozen and before any reference run or unit test","type":"string"},"status":{"const":"planned_not_run","type":"string"},"verify_command":{"const":"python3 -I -B -X utf8 scripts/verify_manifest.py --root . --manifest manifests/SOURCE_SHA256.txt","type":"string"}},"required":["build_command","failure_policy","source_builder_inclusion","stage","status","verify_command"],"type":"object"},"recipe_id":{"const":"BUILD-IFM6-1.1.0-CANDIDATE-001","type":"string"},"recipe_path":{"const":"manifests/BUILD_RECIPE.json","type":"string"},"required_executable_binding_map":{"additionalProperties":false,"properties":{"coping_potential":{"const":"host.baseline.coping_potential","type":"string"},"lambda":{"const":"influence.parameters.lambda","type":"string"},"result":{"const":"output.coping_potential","type":"string"},"z":{"const":"factor_state.level","type":"string"}},"required":["coping_potential","lambda","result","z"],"type":"object"},"schema_version":{"const":"1.0.0","type":"string"},"source_manifest_path":{"const":"manifests/SOURCE_SHA256.txt","type":"string"},"status":{"const":"planned_not_executed","type":"string"},"topology_path":{"const":"manifests/GENERATION_TOPOLOGY.json","type":"string"},"validator_registry":{"additionalProperties":false,"properties":{"acceptance_rule":{"const":"both commands must return exit code zero against the frozen inputs; any missing validator, hash mismatch or nonzero exit blocks BUILD_RECORD, final manifest and archive","type":"string"},"execution_status":{"const":"planned_not_run","type":"string"},"source_manifest_membership":{"const":"every validator path is mandatory in manifests/SOURCE_SHA256.txt","type":"string"},"stage":{"const":"after derived-output validation and before BUILD_RECORD.json and MANIFIESTO_SHA256.txt","type":"string"},"validators":{"const":[{"path":"scripts/validate_derivation_ledger.py","validator_command":"python3 -I -B -X utf8 scripts/validate_derivation_ledger.py --ledger sources/DERIVATION_LEDGER.csv --schema schemas/derivation_ledger.schema.json --provenance PROVENANCE.json","validator_id":"VAL-DERIVATION-LEDGER-001"},{"path":"commands/validate_qa_verdict.py","validator_command":"python3 -I -B -X utf8 commands/validate_qa_verdict.py --record reviews/T03_INTERNAL_QA.json --schema schemas/qa_verdict.schema.json","validator_id":"VAL-QG-PROVENANCE-001"}],"type":"array"}},"required":["acceptance_rule","execution_status","source_manifest_membership","stage","validators"],"type":"object"}},"required":["$schema","schema_version","recipe_id","recipe_path","status","source_manifest_path","topology_path","build_record_path","required_executable_binding_map","binding_artifacts","binding_coverage_rule","generator_registry","validator_registry","planned_commands","pre_run_source_manifest_gate","coverage_contract","build_order","failure_policy","manual_editing_of_derived_nodes"],"title":"IFATIGUE-INFRA6-M6 build recipe contract","type":"object"}
