{"$schema":"../schemas/build_recipe.schema.json","binding_artifacts":{"binding_map_values":{"coping_potential":"host.baseline.coping_potential","lambda":"influence.parameters.lambda","result":"output.coping_potential","z":"factor_state.level"},"consistency_rule":"all twelve registry, resolved-config and implementation locations resolve to the four approved values; missing, duplicate, implicit or divergent bindings block the build","implementation":{"anchor_cardinality":"each semantic anchor occurs exactly once and resolves to the approved binding-map value","path":"src/ifatigue_infra6/model.py","semantic_anchors":{"coping_potential":"@binding-coping-potential","lambda":"@binding-lambda","result":"@binding-result","z":"@binding-z"}},"input_keys":["coping_potential","lambda","z"],"output_key":"result","registry":{"locators":{"coping_potential":"/binding_map/coping_potential","lambda":"/binding_map/lambda","result":"/binding_map/result","z":"/binding_map/z"},"path":"spec/bindings/formula_bindings.json"},"resolved_config":{"locators":{"coping_potential":"/influence/binding_map/coping_potential","lambda":"/influence/binding_map/lambda","result":"/influence/binding_map/result","z":"/influence/binding_map/z"},"path":"config/resolved_instance.json"},"result_is_input":false},"binding_coverage_rule":"the derivation ledger, resolved configuration and implementation must each resolve all four bindings explicitly; no implicit default path is allowed","build_order":["validate authored source, decision, thesis and binding layers","resolve config/resolved_instance.json","validate and freeze input-only scenarios and independent oracles","run python3 -I -B -X utf8 scripts/build_source_manifest.py --root . --output manifests/SOURCE_SHA256.txt","run python3 -I -B -X utf8 scripts/verify_manifest.py --root . --manifest manifests/SOURCE_SHA256.txt and require exit code zero","run the reference scenario recipe and unit tests","validate coverage and all generated outputs","execute every validator_registry entry and require zero exit codes","write manifests/BUILD_RECORD.json","generate and verify MANIFIESTO_SHA256.txt","build deterministic ZIP and its external SHA-256 sidecar"],"build_record_path":"manifests/BUILD_RECORD.json","coverage_contract":{"additional_execution_controls":{"expected":3},"artifacts":{"expected":7,"set_id":"ARTIFACTS-7"},"central_invariants":{"expected":5},"coverage_status":"planned_not_satisfied_until_materialization_and_validation","independent_oracles":{"expected":16,"set_id":"ORACLES-16"},"input_scenarios":{"expected":16,"set_id":"SCENARIOS-16"},"modulation_traces":{"expected":15,"set_id":"TRACES-15"},"pre_modulation_rejections":{"expected":1,"set_id":"REJECTIONS-1"},"reference_results":{"expected":16,"set_id":"RESULTS-16"},"unit_test_methods":{"catalog":"tests/test_catalog.json","expected":18}},"failure_policy":"any missing predecessor, count mismatch, schema failure, hash mismatch, unresolved ledger target or nonzero command exit stops all downstream nodes","generator_registry":{"current_hashes":null,"current_status":"hash_registry_planned_not_attested_in_this_decision","hash_source":"manifests/SOURCE_SHA256.txt","required_paths":["commands/validate_qa_verdict.py","scripts/build_derivation_ledger.py","scripts/build_source_manifest.py","scripts/validate_derivation_ledger.py","scripts/run_scenarios.py","scripts/run_tests.py","scripts/regenerate_evidence.py","scripts/compare_outputs.py","scripts/verify_manifest.py","scripts/build_release.py"],"rule":"BUILD_RECIPE.json records the lowercase SHA-256 of every generator and validator after materialization, every listed executable is included in manifests/SOURCE_SHA256.txt, and any hash mismatch is refused"},"manual_editing_of_derived_nodes":"prohibited","planned_commands":["python3 -I -B -X utf8 scripts/build_derivation_ledger.py --materialize-bindings-config --materialize-schemas","python3 -I -B -X utf8 scripts/validate_derivation_ledger.py --ledger sources/DERIVATION_LEDGER.csv --schema schemas/derivation_ledger.schema.json --provenance PROVENANCE.json","python3 -I -B -X utf8 scripts/build_source_manifest.py --root . --output manifests/SOURCE_SHA256.txt","python3 -I -B -X utf8 scripts/verify_manifest.py --root . --manifest manifests/SOURCE_SHA256.txt","python3 -I -B -X utf8 scripts/run_scenarios.py","python3 -I -B -X utf8 scripts/run_tests.py","python3 -I -B -X utf8 scripts/regenerate_evidence.py","python3 -I -B -X utf8 scripts/compare_outputs.py","python3 -I -B -X utf8 commands/validate_qa_verdict.py --record reviews/T03_INTERNAL_QA.json --schema schemas/qa_verdict.schema.json","python3 -I -B -X utf8 scripts/verify_manifest.py","python3 -I -B -X utf8 scripts/build_release.py"],"pre_run_source_manifest_gate":{"build_command":"python3 -I -B -X utf8 scripts/build_source_manifest.py --root . --output manifests/SOURCE_SHA256.txt","failure_policy":"a missing source member, unexpected member, hash mismatch, malformed record or nonzero exit blocks every reference-run node","source_builder_inclusion":"scripts/build_source_manifest.py is itself an authored generator included in manifests/SOURCE_SHA256.txt","stage":"after all authored inputs, generators and validators are frozen and before any reference run or unit test","status":"planned_not_run","verify_command":"python3 -I -B -X utf8 scripts/verify_manifest.py --root . --manifest manifests/SOURCE_SHA256.txt"},"recipe_id":"BUILD-IFM6-1.1.0-CANDIDATE-001","recipe_path":"manifests/BUILD_RECIPE.json","required_executable_binding_map":{"coping_potential":"host.baseline.coping_potential","lambda":"influence.parameters.lambda","result":"output.coping_potential","z":"factor_state.level"},"schema_version":"1.0.0","source_manifest_path":"manifests/SOURCE_SHA256.txt","status":"planned_not_executed","topology_path":"manifests/GENERATION_TOPOLOGY.json","validator_registry":{"acceptance_rule":"both commands must return exit code zero against the frozen inputs; any missing validator, hash mismatch or nonzero exit blocks BUILD_RECORD, final manifest and archive","execution_status":"planned_not_run","source_manifest_membership":"every validator path is mandatory in manifests/SOURCE_SHA256.txt","stage":"after derived-output validation and before BUILD_RECORD.json and MANIFIESTO_SHA256.txt","validators":[{"path":"scripts/validate_derivation_ledger.py","validator_command":"python3 -I -B -X utf8 scripts/validate_derivation_ledger.py --ledger sources/DERIVATION_LEDGER.csv --schema schemas/derivation_ledger.schema.json --provenance PROVENANCE.json","validator_id":"VAL-DERIVATION-LEDGER-001"},{"path":"commands/validate_qa_verdict.py","validator_command":"python3 -I -B -X utf8 commands/validate_qa_verdict.py --record reviews/T03_INTERNAL_QA.json --schema schemas/qa_verdict.schema.json","validator_id":"VAL-QG-PROVENANCE-001"}]}}
